{
  "slug": "anthropic-en-tetes-beta",
  "titre": "Anthropic : l'en-tête anthropic-beta et les versions bêta de l'API",
  "labo": "anthropic",
  "fonctionnalite": "en-têtes bêta",
  "chapeau": "L'en-tête anthropic-beta ouvre les fonctionnalités expérimentales de l'API Claude. Syntaxe, cumul de plusieurs bêtas, règles propres à Bedrock et Google Cloud, erreurs.",
  "corps": "## Ce que c'est\n\nUne **bêta** de l'API Claude est une fonctionnalité proposée avant d'être intégrée au socle standard. Elle s'active par un nom de version explicite, que l'on transmet dans l'en-tête HTTP `anthropic-beta`. La documentation « Beta headers » décrit ce mécanisme commun : comment envoyer le nom, comment en cumuler plusieurs, comment il se comporte hors de l'API directe (Amazon Bedrock, Google Cloud, Microsoft Foundry), et ce qui se passe quand le nom est refusé.\n\nChaque fonctionnalité en bêta publie son propre nom dans sa propre page. La page d'en-têtes ne dresse pas ce catalogue, elle fixe les règles de transport. C'est donc la page à connaître avant de brancher n'importe quelle bêta, qu'il s'agisse de l'édition de contexte, des agents gérés ou des tunnels MCP.\n\n## Comment ça marche\n\n### Un en-tête, ou un paramètre de SDK\n\nEn appel HTTP brut, la requête vers `/v1/messages` porte les en-têtes `x-api-key`, `anthropic-version: 2023-06-01`, `anthropic-beta` et `content-type`. Avec les SDK officiels, l'en-tête s'écrit à votre place : on appelle l'espace de noms `client.beta` et on passe la liste des noms dans le paramètre `betas`. La documentation indique que les variantes de langage changent la casse (`client.Beta` en C# et en Go, `client.beta()` en Java, `$client->beta` en PHP). La CLI `ant` expose l'équivalent avec l'option `--beta`.\n\n### Cumuler plusieurs bêtas\n\nDeux écritures sont équivalentes pour l'API Claude : une seule ligne d'en-tête avec des noms séparés par des virgules, ou plusieurs lignes `anthropic-beta`. L'API les lit toutes. Côté CLI, `--beta feature1,feature2` fonctionne, tout comme la répétition de l'option.\n\n### Hors de l'API directe\n\nLa documentation précise que les noms de bêta sont les mêmes partout, mais que toutes les plateformes n'acceptent pas toutes les bêtas. Trois points de détail comptent :\n\n- Claude Platform on AWS, Microsoft Foundry et Google Cloud lisent le nom dans l'en-tête `anthropic-beta`. Google Cloud ne lit **qu'un seul** en-tête et ignore les autres : pour envoyer plusieurs bêtas, il faut les mettre dans une même ligne, séparées par des virgules.\n- Claude dans Amazon Bedrock (points d'accès `bedrock-mantle`) utilise aussi l'en-tête.\n- L'API `InvokeModel` de Bedrock lit les bêtas dans le **corps** de la requête, dans un tableau `anthropic_beta`, un nom par élément, et non dans un en-tête.\n\n### Les en-têtes propres à certains points d'accès\n\nCertaines API en bêta exigent un en-tête dédié sur chaque requête :\n\n| Points d'accès | En-tête bêta |\n|---|---|\n| `/v1/agents`, `/v1/sessions`, `/v1/environments` | `managed-agents-2026-04-01` |\n| `/v1/tunnels` | `mcp-tunnels-2026-06-22` |\n| `/v1/memory_stores` et sous-ressources | `agent-memory-2026-07-22` |\n\nLe SDK ajoute ces en-têtes automatiquement via `client.beta`. On ne les écrit soi-même que pour des requêtes HTTP brutes. Les noms suivent le plus souvent le motif `nom-de-la-fonctionnalite-AAAA-MM-JJ`, la date étant celle de la sortie de la bêta ; la documentation demande d'utiliser le nom exact tel que publié.\n\n## En pratique\n\nVoici la requête de la documentation, qui active l'édition de contexte (`context-management-2025-06-27`) sur le modèle `claude-opus-5-5` :\n\n```bash\ncurl https://api.anthropic.com/v1/messages \\\n  -H \"x-api-key: $ANTHROPIC_API_KEY\" \\\n  -H \"anthropic-version: 2023-06-01\" \\\n  -H \"anthropic-beta: context-management-2025-06-27\" \\\n  -H \"content-type: application/json\" \\\n  -d '{\n    \"model\": \"claude-opus-5-5\",\n    \"max_tokens\": 1024,\n    \"messages\": [\n      {\"role\": \"user\", \"content\": \"Hello, Claude\"}\n    ]\n  }'\n```\n\nLa même requête avec le SDK Python :\n\n```python\nclient = Anthropic()\n\nresponse = client.beta.messages.create(\n    model=\"claude-opus-5-5\",\n    max_tokens=1024,\n    messages=[{\"role\": \"user\", \"content\": \"Hello, Claude\"}],\n    betas=[\"context-management-2025-06-27\"],\n)\n\nprint(response.content)\n```\n\nPour cumuler deux bêtas en Python, la documentation indique de lister chaque nom dans `betas`, par exemple `betas=[\"feature1\", \"feature2\"]` (les noms `feature1` et `feature2` sont des substituts de la documentation, pas de vraies fonctionnalités).\n\n**Cas d'usage.** Une équipe plateforme exploite un service qui appelle Claude à la fois depuis l'API directe et depuis Google Cloud. Un développeur ajoute une deuxième bêta en répétant la ligne `anthropic-beta` ; en local tout fonctionne, mais sur Google Cloud la seconde bêta ne produit aucun effet, car cette plateforme ne lit qu'un seul en-tête. La règle de la documentation (une ligne, des virgules) règle le problème. Autre situation : une équipe qui appelle les magasins de mémoire en HTTP brut envoie à la fois `managed-agents-2026-04-01` et `agent-memory-2026-07-22` par habitude, et reçoit une erreur 400.\n\n## Ce que ça change, et où ça s'arrête\n\nLe mécanisme apporte un accès anticipé aux nouveautés sans changer de version d'API : `anthropic-version` reste à `2023-06-01`, seul le nom de bêta varie. Il n'a pas de coût propre dans la documentation, mais celle-ci avertit que les fonctionnalités en bêta sont expérimentales et peuvent connaître des changements cassants annoncés, être dépréciées ou retirées, avoir des limites de débit ou une tarification différentes, ou ne pas être disponibles dans toutes les régions. La documentation ne chiffre pas ces écarts : ils se lisent dans la page de chaque fonctionnalité.\n\nCôté erreurs, un nom invalide, ou une bêta à laquelle l'organisation n'a pas accès, renvoie une erreur HTTP 400 de type `invalid_request_error`, dont le message indique la valeur inattendue de l'en-tête `anthropic-beta`. Ce cas est facile à confondre avec une faute de frappe : l'accès organisationnel produit la même réponse.\n\nDernière limite à connaître : sur les points d'accès des magasins de mémoire, `agent-memory-2026-07-22` **remplace** `managed-agents-2026-04-01`. Les envoyer ensemble sur la même requête provoque une erreur 400. La documentation ne dit pas que cette règle d'exclusivité vaut pour d'autres couples d'en-têtes ; elle écrit seulement que des en-têtes propres à un même point d'accès ne sont « pas toujours combinables ». Dans le doute, le plus sûr consiste à passer par `client.beta`, qui choisit l'en-tête correct pour chaque point d'accès.",
  "tags": [
    "api",
    "beta",
    "en-tetes",
    "bedrock"
  ],
  "sources": [
    {
      "titre": "Documentation Claude — Beta headers",
      "url": "https://platform.claude.com/docs/en/api/beta-headers",
      "consultee": "2026-10-16"
    },
    {
      "titre": "Documentation Claude — index de la documentation (llms.txt)",
      "url": "https://platform.claude.com/llms.txt",
      "consultee": "2026-10-16"
    }
  ],
  "date": "2026-10-16T08:00:00+02:00",
  "type": "explication",
  "statut": "publie"
}
