{
  "slug": "openai-generation-video-sora",
  "titre": "OpenAI : générer des vidéos avec l'API Sora",
  "date": "2026-08-23T08:15:00+02:00",
  "type": "explication",
  "labo": "openai",
  "fonctionnalite": "génération vidéo",
  "chapeau": "L'API vidéo d'OpenAI génère des clips avec les modèles Sora à partir d'un prompt texte, comme un traitement asynchrone dont on interroge l'état jusqu'au rendu final. Deux modèles se partagent des tarifs et des résolutions différents, du 720p au 1080p.",
  "corps": "## Ce que c'est\n\nL'API vidéo d'OpenAI permet de générer des clips vidéo à partir d'un prompt texte, avec les modèles de la famille Sora. Deux modèles sont exposés : `sora-2`, et `sora-2-pro`, réservé aux rendus en plus haute résolution. La génération n'est pas immédiate : elle fonctionne comme un traitement asynchrone, un job que l'on crée puis dont on interroge l'état jusqu'à ce que la vidéo soit prête à être téléchargée.\n\nAu-delà de la génération à partir d'un simple texte, l'API couvre aussi la prolongation d'une vidéo existante, des modifications ciblées sur une vidéo déjà générée, et la réutilisation d'un même personnage d'une vidéo à l'autre.\n\n## Comment ça marche\n\nLa création d'un job de génération se fait par `POST /v1/videos`, avec au minimum un `model` et un `prompt`. Les paramètres documentés sont :\n\n- `model` : `sora-2` ou `sora-2-pro` ;\n- `prompt` : la description textuelle du plan à générer ;\n- `size` : la résolution et l'orientation, par exemple `1280x720`, `1920x1080` ou `1080x1920` ;\n- `seconds` : la durée du clip, `16` ou `20`, prise en charge par les deux modèles ;\n- `input_reference` : une image fournie en entrée, utilisée comme première image du clip pour guider la génération ; ses dimensions doivent correspondre au `size` demandé.\n\nLa réponse initiale renvoie un objet job avec un `id` et un `status`, qui prend successivement les valeurs `queued`, `in_progress`, puis `completed` ou `failed`. L'application interroge cet état avec `GET /v1/videos/{video_id}`, ou s'abonne aux événements `video.completed` et `video.failed` par webhook plutôt que d'interroger l'API à intervalles réguliers. Une fois le job terminé, le fichier se récupère par `GET /v1/videos/{video_id}/content`, avec un paramètre `variant` qui vaut `video` par défaut pour le fichier MP4, ou `thumbnail` pour une image d'aperçu au format WebP, ou `spritesheet` pour une planche de vignettes au format JPG.\n\nTrois opérations complémentaires existent : `POST /v1/videos/extensions` prolonge une vidéo déjà générée, par tranches de 20 secondes supplémentaires, jusqu'à six extensions au maximum, soit 120 secondes cumulées, en conservant le mouvement et la continuité du clip d'origine ; `POST /v1/videos/edits` applique une modification ciblée à une vidéo existante sans la régénérer entièrement ; `POST /v1/videos/characters` téléverse un court clip de deux à quatre secondes pour enregistrer un personnage réutilisable, dont l'identifiant et le nom peuvent ensuite être référencés dans le prompt d'autres générations pour garder une apparence cohérente d'un clip à l'autre — une fonctionnalité que les extensions, elles, ne prennent pas en charge.\n\n## En pratique\n\nUne équipe marketing veut produire une série de courtes séquences vidéo pour illustrer un article de blog ou une publicité interne — un plan large sur un produit, une scène d'ambiance — sans mobiliser une équipe de tournage. Le prompt décrit directement le plan attendu : type de cadrage, sujet, action, décor, lumière. La documentation illustre ce niveau de détail avec un exemple du type « plan large d'un enfant qui fait voler un cerf-volant rouge dans un parc, lumière dorée de fin de journée, la caméra remonte lentement ».\n\nUne génération simple en `curl` :\n\n```bash\ncurl -X POST \"https://api.openai.com/v1/videos\" \\\n  -H \"Authorization: Bearer $OPENAI_API_KEY\" \\\n  -F prompt=\"Wide tracking shot of a teal coupe driving through desert\" \\\n  -F model=\"sora-2-pro\" \\\n  -F size=\"1280x720\" \\\n  -F seconds=\"8\"\n```\n\nEt l'équivalent en Python, avec le SDK officiel :\n\n```python\nfrom openai import OpenAI\n\nopenai = OpenAI()\nvideo = openai.videos.create(\n    model=\"sora-2\",\n    prompt=\"A video of a cool cat on a motorcycle in the night\"\n)\n```\n\nUne fois le job créé, l'application interroge périodiquement `GET /v1/videos/{video_id}` — la documentation recommande un intervalle de dix à vingt secondes — jusqu'à ce que `status` passe à `completed`, avant de récupérer le fichier MP4 via l'endpoint de téléchargement.\n\n## Ce que ça change, et où ça s'arrête\n\nLa tarification est au prorata du nombre de secondes générées, et dépend du modèle et de la résolution : 0,10 $ par seconde pour `sora-2` en 720p, contre 0,30 $ par seconde pour `sora-2-pro` à la même résolution, 0,50 $ en 1024p et 0,70 $ en 1080p. Les jobs soumis par lot (Batch API) bénéficient d'un tarif réduit de moitié sur chacun de ces montants. Un clip de 20 secondes en `sora-2-pro` 1080p revient donc nettement plus cher qu'un clip court en `sora-2` 720p — un facteur à intégrer avant de générer des variantes en volume.\n\nSur la latence, la documentation prévient qu'un rendu isolé peut prendre plusieurs minutes, la durée augmentant avec la résolution et la longueur demandées, ce qui exclut cette API d'un usage synchrone dans une réponse utilisateur immédiate.\n\nLes restrictions de contenu sont strictes et documentées explicitement : le contenu doit convenir à un public de moins de 18 ans, aucun personnage sous droit d'auteur ni musique protégée n'est autorisé, et aucune personne réelle — y compris une personnalité publique — ne peut être générée. Les images d'entrée montrant un visage humain sont rejetées, et le téléversement d'un personnage reproduisant une ressemblance humaine est bloqué par défaut. Sur le plan opérationnel, les URL de téléchargement expirent au bout d'une heure — il faut donc récupérer et stocker durablement le fichier sans délai — et les vidéos générées par lot restent disponibles au téléchargement pendant 24 heures après la fin du traitement.\n",
  "tags": [
    "api",
    "video",
    "sora",
    "generation"
  ],
  "sources": [
    {
      "titre": "OpenAI — Video generation guide",
      "url": "https://developers.openai.com/api/docs/guides/video-generation",
      "consultee": "2026-08-23"
    },
    {
      "titre": "OpenAI — Pricing",
      "url": "https://developers.openai.com/api/docs/pricing",
      "consultee": "2026-08-23"
    }
  ],
  "statut": "publie"
}
