{
  "slug": "gemini-comprehension-image",
  "titre": "Gemini : analyser une image avec l'API Interactions",
  "date": "2026-08-05T12:00:00+02:00",
  "type": "explication",
  "labo": "gemini",
  "fonctionnalite": "compréhension d'image",
  "chapeau": "L'API Interactions de Gemini peut décrire, classer ou interroger le contenu d'une image envoyée en base64, par URL ou via l'API Files. Le coût en tokens dépend de la taille de l'image, comptée par tuiles de 768x768 pixels.",
  "corps": "L'API Gemini peut analyser une image transmise avec une requête texte et en tirer une description, une classification ou une réponse à une question précise sur son contenu. Cette capacité passe désormais par l'API Interactions, qui remplace l'ancien schéma de requête pour la lecture d'images comme pour le texte.\n\n## Ce que c'est\n\nLa compréhension d'image permet à un modèle Gemini de traiter une image en entrée au même titre qu'un texte, pour produire une légende, répondre à une question sur son contenu, classer ce qu'elle représente, ou repérer et délimiter des objets qui s'y trouvent. La documentation officielle situe cette capacité dans l'API Interactions, appelée avec `client.interactions.create()`, où l'entrée `input` est un tableau qui mélange des objets de type `\"text\"` et des objets de type `\"image\"` plutôt qu'un simple texte de requête.\n\n## Comment ça marche\n\nUne image peut être transmise de trois façons. La première est une référence directe à une URL HTTPS publique. La deuxième consiste à encoder l'image en base64 et à l'inclure telle quelle dans la requête — cette méthode est plafonnée par la taille totale de la requête, fixée à 20 Mo pour l'ensemble du texte, des instructions système et des données binaires en ligne. La troisième, recommandée pour les fichiers volumineux ou réutilisés sur plusieurs requêtes, passe par l'API Files : le fichier est envoyé une fois avec `client.files.upload()`, qui renvoie un objet exposant une `uri` et un `mime_type`, réutilisables ensuite dans un objet `{\"type\": \"image\", \"uri\": ..., \"mime_type\": ...}` de l'entrée `input`.\n\nLes formats pris en charge documentés sont PNG (`image/png`), JPEG (`image/jpeg`), WEBP (`image/webp`), HEIC (`image/heic`) et HEIF (`image/heif`). Le coût en tokens d'une image dépend de sa taille : une image dont les deux dimensions ne dépassent pas 384 pixels coûte 258 tokens ; au-delà, l'image est découpée en tuiles de 768×768 pixels, chacune facturée 258 tokens. Une requête peut contenir jusqu'à 3 600 fichiers images. Un paramètre `media_resolution` permet d'arbitrer entre le niveau de détail exploitable par le modèle et le coût en tokens ainsi que la latence.\n\nDeux usages spécialisés s'appuient sur la même capacité : la détection d'objets et la segmentation. Toutes deux renvoient une sortie structurée en JSON — des boîtes englobantes normalisées sur une échelle de 0 à 1000 pour la détection, des masques polygonaux pour la segmentation. La documentation recommande de réduire le raisonnement du modèle au minimum pour ces deux usages, la profondeur de raisonnement n'apportant pas de gain de précision sur ce type de sortie et ajoutant surtout de la latence.\n\n## En pratique\n\nVoici l'exemple documenté d'envoi d'une image via l'API Files, accompagnée d'une demande de légende :\n\n```python\nfrom google import genai\n\nclient = genai.Client()\n\nuploaded_file = client.files.upload(file=\"path/to/organ.jpg\")\n\ninteraction = client.interactions.create(\n    model=\"gemini-3.6-flash\",\n    input=[\n        {\"type\": \"text\", \"text\": \"Caption this image.\"},\n        {\n            \"type\": \"image\",\n            \"uri\": uploaded_file.uri,\n            \"mime_type\": uploaded_file.mime_type\n        }\n    ]\n)\nprint(interaction.output_text)\n```\n\nLe fichier est d'abord envoyé une fois via `client.files.upload()`, puis référencé par son `uri` et son `mime_type` dans l'entrée de l'appel à `client.interactions.create()` ; la réponse textuelle est disponible sur `interaction.output_text`.\n\nUn service logistique qui reçoit des photos de colis endommagés prises par ses livreurs peut construire un traitement automatisé : chaque photo est envoyée via l'API Files, puis analysée avec une consigne du type « décris l'état du colis et indique s'il est probable que le contenu soit endommagé ». Le texte renvoyé alimente directement la fiche d'incident, sans qu'un opérateur humain ait à ouvrir et regarder chaque photo pour en faire une première description.\n\n## Ce que ça change, et où ça s'arrête\n\nL'apport concret de cette capacité est de traiter une image sans passer par un modèle de vision séparé à intégrer : le même appel qui produit du texte à partir de texte peut produire du texte à partir d'une image, avec le même modèle et la même API. Le passage à l'API Interactions change la forme des requêtes par rapport à l'ancien schéma texte seul : l'entrée devient systématiquement un tableau `input` mixte, ce qui demande d'adapter le code existant plutôt que d'ajouter un paramètre optionnel à un appel déjà en place.\n\nLe coût en tokens croît avec la taille de l'image, par tuiles de 768×768 pixels, ce qui rend le traitement d'images haute résolution mécaniquement plus coûteux qu'une image redimensionnée en amont si la définition n'est pas nécessaire à la tâche. La limite de 20 Mo sur les données encodées en ligne, cumulée au texte de la requête, pousse à basculer vers l'API Files dès que les images dépassent quelques mégaoctets ou sont réutilisées sur plusieurs appels. Pour la détection d'objets et la segmentation, la documentation elle-même signale une contrepartie de qualité liée au raisonnement : le désactiver améliore la fiabilité des sorties structurées, ce qui va à l'encontre du réflexe consistant à laisser le raisonnement actif par défaut pour les tâches complexes. La documentation consultée ne précise pas de limite de résolution maximale par image ni de détail sur le comportement en cas d'image corrompue ou dans un format non listé.",
  "tags": [
    "vision",
    "api",
    "images",
    "outils"
  ],
  "sources": [
    {
      "titre": "Gemini API Docs — Image understanding",
      "url": "https://ai.google.dev/gemini-api/docs/image-understanding",
      "consultee": "2026-08-05"
    },
    {
      "titre": "Gemini API Docs — Documentation d'ensemble",
      "url": "https://ai.google.dev/gemini-api/docs",
      "consultee": "2026-08-05"
    }
  ],
  "statut": "publie"
}
