{
  "slug": "anthropic-restriction-domaines-outils-web",
  "titre": "Anthropic : limiter les domaines que les outils web d'un agent atteignent",
  "date": "2026-09-15T08:00:00+02:00",
  "type": "explication",
  "labo": "anthropic",
  "fonctionnalite": "restriction de domaines pour les outils web",
  "chapeau": "Sur Claude Managed Agents, les outils web_search et web_fetch peuvent être bornés à une liste blanche ou noire de domaines, réglée par agent et combinée entre agents dans une session multi-agents.",
  "corps": "## Ce que c'est\n\nUn agent Claude Managed Agents dispose par défaut de deux outils qui touchent au web ouvert : `web_search`, qui interroge un moteur de recherche, et `web_fetch`, qui récupère le contenu d'une URL. Laissés sans réglage, ces deux outils peuvent atteindre n'importe quel site accessible depuis les serveurs d'Anthropic. La documentation de la plateforme décrit un mécanisme de restriction par domaine : sur chaque entrée `web_search` ou `web_fetch` de la configuration d'outils d'un agent, on peut poser une liste blanche (`allowed_domains`) ou une liste noire (`blocked_domains`) de noms d'hôtes.\n\nCe réglage ne concerne que ces deux outils précis. Il ne touche ni au réseau du bac à sable où s'exécutent `bash`, `read` ou `write` — celui-ci se configure séparément, au niveau de l'environnement — ni aux réglages de domaines que l'on peut fixer dans la console Claude pour l'API Messages classique, qui ne s'appliquent pas aux sessions Managed Agents.\n\n## Comment ça marche\n\nLa restriction se pose dans le tableau `configs` du toolset `agent_toolset_20260401`, à la création ou à la mise à jour d'un agent. Chaque entrée porte un `name` (`web_search` ou `web_fetch`) et accepte soit `allowed_domains`, soit `blocked_domains` — jamais les deux à la fois sur la même entrée, la requête est rejetée sinon avec une erreur 400 qui cite le champ fautif.\n\nLes règles de format sont strictes. Un domaine s'écrit comme un nom d'hôte nu, sans schéma ni port (`example.com`, pas `https://example.com` ni `example.com:443`), sans jocker (`*.example.com` est refusé) et sans adresse IP sous aucune forme. Une entrée couvre le domaine listé et tous ses sous-domaines : `example.com` couvre `docs.example.com`, mais l'inverse est faux, et un sous-domaine `www.` ne couvre pas le domaine nu — il faut lister les deux si les deux doivent être atteignables. Un domaine de premier niveau seul (`com`, `co.uk`) ou un nom à un seul niveau (`intranet`) est rejeté, de même que `localhost` et les suffixes `.local`, `.internal`, `.invalid`. Chaque liste accepte de 1 à 64 domaines.\n\n`web_fetch` accepte uniquement des noms d'hôtes, sans chemin. `web_search` tolère en plus un suffixe de chemin (`example.com/blog`), le moteur de recherche le traitant comme un motif d'URL plutôt que comme une règle d'hôte stricte — la documentation recommande d'ailleurs de s'en tenir à des noms d'hôtes nus même pour `web_search`.\n\nAu moment de l'exécution, un appel `web_fetch` vers une URL qui ne passe pas les listes revient à l'agent comme un résultat d'erreur : l'événement `agent.tool_result` porte `is_error: true` et un contenu qui nomme le code `url_not_allowed`. Côté `web_search`, les résultats qui ne passent pas les listes sont simplement omis de la réponse, sans erreur visible.\n\nDeux réglages supplémentaires accompagnent les mêmes entrées : `max_content_tokens` sur `web_fetch` plafonne la quantité de contenu de page injectée dans le contexte, et `user_location` sur `web_search` localise les résultats de recherche (mêmes champs que le paramètre `user_location` de l'API Messages).\n\nDans une session multi-agents, les listes se combinent plutôt que de se remplacer : un agent du roster hérite des listes du coordinateur qui l'a appelé, et ne peut que les restreindre davantage, jamais les élargir. Si les listes blanches combinées ne laissent plus aucun domaine commun, l'outil reste présent mais tous ses appels échouent avec `url_not_allowed`.\n\n## En pratique\n\nUne équipe qui construit un agent de support technique interne avec Managed Agents veut que l'agent ne consulte que la documentation de l'entreprise et, en complément, les articles de recherche cités par cette documentation — jamais un blog tiers non vérifié ni un forum. Elle limite `web_search` à deux domaines et bloque un domaine publicitaire connu pour `web_fetch`, tout en plafonnant la quantité de texte que `web_fetch` peut faire entrer dans le contexte :\n\n```bash\nagent=$(curl -fsSL https://api.anthropic.com/v1/agents \\\n  -H \"x-api-key: $ANTHROPIC_API_KEY\" \\\n  -H \"anthropic-version: 2023-06-01\" \\\n  -H \"anthropic-beta: managed-agents-2026-04-01\" \\\n  -H \"content-type: application/json\" \\\n  -d @- <<'EOF'\n{\n  \"name\": \"Support Agent\",\n  \"model\": \"claude-opus-5\",\n  \"tools\": [\n    {\n      \"type\": \"agent_toolset_20260401\",\n      \"configs\": [\n        {\n          \"type\": \"web_search\",\n          \"name\": \"web_search\",\n          \"allowed_domains\": [\"docs.example.com\", \"arxiv.org\"]\n        },\n        {\n          \"type\": \"web_fetch\",\n          \"name\": \"web_fetch\",\n          \"blocked_domains\": [\"ads.example.com\"],\n          \"max_content_tokens\": 50000\n        }\n      ]\n    }\n  ]\n}\nEOF\n)\n```\n\nAvec cette configuration, une question qui pousserait l'agent à chercher une explication sur un blog d'actualité tech quelconque ne remontera aucun résultat de ce site dans `web_search` — il reste invisible au modèle, sans message d'erreur particulier. Une tentative explicite de `web_fetch` vers une URL hors liste, elle, revient comme une erreur `url_not_allowed` que l'agent peut voir et sur laquelle il peut réagir, par exemple en le signalant dans sa réponse plutôt qu'en échouant silencieusement.\n\nLe réglage se modifie aussi en cours de route : sur une session inactive (`idle`), on peut mettre à jour les outils pour resserrer ou desserrer les listes, ce qui s'applique dès le tour suivant sans recréer l'agent ni la session.\n\n## Ce que ça change, et où ça s'arrête\n\nLe bénéfice concret est le contrôle de la provenance : un agent dont les outils web sont bornés à un petit nombre de domaines de confiance ne peut plus citer, ni faire remonter dans ses réponses, du contenu venu d'ailleurs — utile pour un agent orienté conformité ou pour limiter le risque qu'une page malveillante injecte des instructions dans le contexte via `web_fetch`.\n\nLes limites sont documentées précisément. Le plafond de 64 domaines par liste et l'interdiction des adresses IP rendent le mécanisme impraticable pour verrouiller un grand nombre de destinations dynamiques. La validation se fait à la création ou à la mise à jour de l'agent, puis une seconde fois à l'initialisation de la session : un domaine que le robot d'indexation d'Anthropic n'est pas autorisé à atteindre, par exemple, peut être accepté au moment de la création de l'agent et provoquer un événement `session.error` seulement au démarrage de la session, qui repasse alors à l'état `idle` sans retenter automatiquement. Le réglage ne protège pas non plus le bac à sable lui-même : un agent qui a accès à `bash` peut toujours faire sortir du trafic réseau par d'autres moyens si l'environnement l'y autorise, ce que les listes de domaines de `web_search` et `web_fetch` ne couvrent pas. Et dans une session multi-agents, la documentation prévient qu'un mauvais calibrage des listes par agent du roster peut aboutir à un outil disponible mais qui échoue systématiquement, ce qui n'est pas la même chose qu'un outil retiré proprement de la configuration.",
  "tags": [
    "managed agents",
    "outils",
    "web search",
    "sécurité"
  ],
  "sources": [
    {
      "titre": "Managed Agents — Tools (restrict web search and web fetch domains)",
      "url": "https://platform.claude.com/docs/en/managed-agents/tools",
      "consultee": "2026-09-15"
    },
    {
      "titre": "Claude Platform Release Notes",
      "url": "https://platform.claude.com/docs/en/release-notes/overview",
      "consultee": "2026-09-15"
    }
  ],
  "statut": "publie"
}
