{
  "slug": "anthropic-cache-automatique-prompt",
  "titre": "Anthropic : un cache de prompt qui avance seul dans la conversation",
  "date": "2026-09-24T08:00:00+02:00",
  "type": "explication",
  "labo": "anthropic",
  "fonctionnalite": "cache automatique de prompt",
  "chapeau": "Anthropic documente une manière de simplifier le cache de prompt à un seul champ placé au niveau de la requête, qui déplace seul le point de coupure à chaque tour d'une conversation. Le repérage manuel par bloc reste disponible en complément.",
  "corps": "Le cache de prompt d'Anthropic permet de conserver côté serveur une portion figée d'une requête pour la relire aux appels suivants plutôt que de la retraiter. Jusqu'ici, ce mécanisme se pilotait bloc par bloc : chaque appel devait porter un champ `cache_control` placé explicitement sur le contenu à mettre en cache, et il fallait déplacer ce repère soi-même à mesure qu'une conversation s'allongeait. La documentation d'Anthropic décrit désormais une seconde façon d'activer le cache, en une seule ligne de configuration, qui suit automatiquement la conversation sans intervention supplémentaire.\n\n## Ce que c'est\n\nLe cache automatique de prompt consiste à placer un unique champ `cache_control` au niveau racine du corps de la requête, plutôt que sur un ou plusieurs blocs de contenu pris séparément. Une fois ce champ posé, le système repère lui-même le dernier bloc éligible au cache et y place le point de coupure ; à l'appel suivant, si la conversation s'est allongée d'un tour supplémentaire, ce point de coupure avance tout seul jusqu'au nouveau dernier bloc. La documentation présente cette approche comme la manière la plus simple d'activer le cache de prompt, en particulier pour les conversations à plusieurs tours dont la taille augmente d'un appel à l'autre. Le mécanisme de repères explicites, posé directement sur des blocs de contenu individuels, continue d'exister en parallèle et reste préférable quand des sections d'un prompt changent à des rythmes différents.\n\n## Comment ça marche\n\nL'activation se fait en ajoutant un champ `cache_control` au niveau racine de l'objet envoyé à l'API Messages, à côté de `model`, `max_tokens`, `system` et `messages` :\n\n```json\n{\n  \"model\": \"claude-opus-5-5\",\n  \"max_tokens\": 1024,\n  \"cache_control\": {\"type\": \"ephemeral\"},\n  \"system\": \"Instructions système du projet.\",\n  \"messages\": [\n    {\"role\": \"user\", \"content\": \"Premier message de l'utilisateur.\"}\n  ]\n}\n```\n\nLe seul type accepté pour ce champ est `\"ephemeral\"`. Un champ optionnel `ttl` permet de choisir la durée de vie du cache : `\"5m\"` par défaut, ou `\"1h\"` pour une conservation plus longue. Dans une conversation qui s'étoffe tour après tour, le comportement décrit par la documentation est le suivant : au premier appel, tout ce qui précède le dernier message est écrit en cache ; à l'appel suivant, tout ce qui a déjà été écrit est relu depuis le cache, et seule la portion ajoutée depuis — la réponse précédente de Claude et le nouveau message — est à son tour écrite en cache. Le point de coupure se déplace ainsi de lui-même, sans qu'il soit nécessaire de recalculer où placer un repère `cache_control` à chaque appel.\n\nLe cache automatique et les repères explicites peuvent cohabiter : combiné à des repères posés sur des blocs précis, le cache automatique consomme l'un des quatre emplacements de repère disponibles par requête. Deux cas font échouer l'appel avec une erreur 400 : un dernier bloc porte déjà un repère explicite avec un `ttl` différent de celui demandé au niveau racine, ou les quatre emplacements de repère sont déjà occupés par des repères explicites. Si le dernier bloc porte déjà un repère explicite avec le même `ttl`, le champ racine ne fait rien de plus, sans erreur. Les seuils minimaux de jetons pour qu'un bloc soit éligible au cache restent ceux du mécanisme existant, entre 512 jetons pour les modèles les plus récents et jusqu'à 4096 pour certains modèles plus anciens. Le mécanisme est disponible sur l'ensemble des modèles Claude actifs, sauf sur les déploiements Amazon Bedrock antérieurs à Opus 4.6, où seuls les repères explicites restent utilisables. La réponse de l'API continue de porter les mêmes compteurs qu'avec les repères manuels : `cache_read_input_tokens` pour les jetons relus depuis le cache, `cache_creation_input_tokens` pour ceux qui viennent d'y être écrits, et `input_tokens` pour ceux qui suivent le dernier point de coupure.\n\n## En pratique\n\nUne équipe qui construit un assistant de support technique conserve typiquement tout l'historique de la conversation à chaque appel, pour que Claude garde le contexte des messages précédents. Sans cache automatique, il faudrait recalculer à chaque tour quel bloc de la liste `messages` porte désormais le dernier repère `cache_control`, et déplacer ce repère en conséquence. Avec le champ racine, il suffit de l'envoyer une fois par requête, à l'identique, quel que soit le nombre de tours déjà échangés :\n\n```python\nimport anthropic\n\nclient = anthropic.Anthropic()\n\nresponse = client.messages.create(\n    model=\"claude-opus-5-5\",\n    max_tokens=1024,\n    cache_control={\"type\": \"ephemeral\"},\n    system=\"Tu es l'assistant support de l'application Facturea.\",\n    messages=[\n        {\"role\": \"user\", \"content\": \"Je n'arrive pas a telecharger ma facture de mars.\"},\n        {\"role\": \"assistant\", \"content\": \"Pouvez-vous me donner le numero de commande associe ?\"},\n        {\"role\": \"user\", \"content\": \"C'est la commande 48213.\"},\n    ],\n)\nprint(response.usage.model_dump_json())\n```\n\nÀ chaque nouveau tour, l'équipe ajoute simplement le message suivant à la liste et renvoie le même appel : le système reconnaît la partie déjà vue, la relit depuis le cache, et n'écrit que la portion ajoutée. Pour un historique qui peut atteindre plusieurs dizaines de tours sur une session de support longue, cela évite d'introduire une logique de calcul de repère côté application, dont une erreur ferait retomber silencieusement tout l'historique en traitement complet plutôt qu'en lecture de cache.\n\n## Ce que ça change, et où ça s'arrête\n\nL'apport du cache automatique tient à ce qu'il retire une source d'erreur : un repère mal replacé, dans le mécanisme manuel, fait perdre le bénéfice du cache sans que l'appel échoue pour autant, ce qui rend le problème difficile à repérer. En confiant ce calcul au système, la charge de suivi disparaît pour le cas le plus courant, celui d'une conversation qui s'allonge tour après tour. La tarification ne change pas : les écritures en cache de 5 minutes coûtent 1,25 fois le prix des jetons d'entrée standard, celles d'une heure 2 fois ce prix, et une lecture de cache coûte une fraction de ce même prix, variable selon le modèle. Le cache automatique n'introduit ni surcoût ni remise propres à lui.\n\nLes limites documentées restent celles du cache de prompt en général : ce n'est pas un cache sémantique, une modification du contenu situé avant le point de coupure invalide la portion concernée, et la fenêtre de recherche du serveur reste bornée dans le temps par le `ttl` choisi. Le champ racine ne convient pas à toutes les structures de prompt : quand un prompt système volumineux et rarement modifié doit rester distinct d'un historique de conversation qui change à chaque tour, les repères explicites, posés indépendamment sur chacune de ces sections, gardent l'avantage de contrôler précisément ce qui est mis en cache et à quel rythme. La documentation recommande d'ailleurs de partir du cache automatique pour les conversations à plusieurs tours, et de garder les repères explicites pour les sections aux rythmes de changement distincts.",
  "tags": [
    "cache",
    "api",
    "conversation",
    "cout"
  ],
  "sources": [
    {
      "titre": "Documentation Claude — Prompt caching (cache automatique)",
      "url": "https://platform.claude.com/docs/en/build-with-claude/prompt-caching",
      "consultee": "2026-09-24"
    },
    {
      "titre": "Documentation Claude — Vue d'ensemble des fonctionnalités",
      "url": "https://platform.claude.com/docs/en/build-with-claude/overview",
      "consultee": "2026-09-24"
    }
  ],
  "statut": "publie"
}
