{
  "slug": "anthropic-depots-github-agents-geres",
  "titre": "Anthropic : monter un dépôt GitHub dans une session d'agent géré",
  "date": "2026-10-18T08:00:00+02:00",
  "type": "explication",
  "labo": "anthropic",
  "fonctionnalite": "dépôts github des agents gérés",
  "chapeau": "Une session d'agent géré peut cloner un dépôt GitHub dans son bac à sable et ouvrir des pull requests via le serveur GitHub MCP. Mise en place, champs et limites de cette bêta.",
  "tags": [
    "agents gérés",
    "github",
    "mcp",
    "api"
  ],
  "sources": [
    {
      "titre": "Documentation Anthropic — Accessing GitHub (Managed Agents)",
      "url": "https://platform.claude.com/docs/en/managed-agents/github",
      "consultee": "2026-10-18"
    },
    {
      "titre": "Documentation Anthropic — index de la documentation (llms.txt)",
      "url": "https://platform.claude.com/docs/llms.txt",
      "consultee": "2026-10-18"
    }
  ],
  "corps": "## Ce que c'est\n\nLes agents gérés (*Managed Agents*) d'Anthropic exécutent un agent dans un bac à sable côté serveur, avec une session par tâche. Depuis cette session, l'agent peut travailler sur du code hébergé sur GitHub de deux façons complémentaires : un dépôt est **cloné dans le bac à sable** comme ressource de session, et un serveur **GitHub MCP** donne à l'agent des outils pour créer des branches, valider des modifications et ouvrir des pull requests. MCP (*Model Context Protocol*) est le protocole par lequel un agent découvre et appelle des outils exposés par un serveur externe.\n\nLa documentation signale que les dépôts GitHub sont mis en cache : les sessions suivantes qui réutilisent le même dépôt démarrent plus vite. Elle classe la fonctionnalité en bêta, avec l'en-tête `anthropic-beta: managed-agents-2026-04-01`.\n\n## Comment ça marche\n\nLa mise en place se fait en deux temps : l'agent, puis la session.\n\n**1. L'agent déclare le serveur GitHub MCP.** La définition de l'agent contient l'URL du serveur, `https://api.githubcopilot.com/mcp/`, mais aucun jeton d'authentification. Elle associe un `mcp_servers` (le serveur, nommé ici `github`) à un `mcp_toolset` qui pointe vers ce nom avec `mcp_server_name`, et active l'ensemble d'outils standard `agent_toolset_20260401`.\n\n**2. La session monte le dépôt.** Le dépôt est une entrée du tableau `resources`, de type `github_repository`. Ses champs :\n\n| Champ | Rôle |\n|---|---|\n| `type` | Obligatoire, vaut `\"github_repository\"`. |\n| `url` | Obligatoire. URL HTTPS de la forme `https://github.com/<owner>/<repo>`, sans suffixe `.git`. Les autres formes, SSH compris, sont rejetées avec une `invalid_request_error`. |\n| `authorization_token` | Obligatoire. Jeton GitHub servant à cloner. Il n'est pas renvoyé dans les réponses de l'API. |\n| `mount_path` | Facultatif. Dossier de clonage sous `/workspace`. Par défaut `/workspace/<nom-du-dépôt>`. |\n| `checkout` | Facultatif. Une branche (`{\"type\": \"branch\", \"name\": \"main\"}`) ou un commit (`{\"type\": \"commit\", \"sha\": \"...\"}`). Par défaut, la branche par défaut du dépôt. |\n\nMonter un dépôt charge aussi les *skills* présents dans son dossier `.claude/skills` à la racine. Ils sont découverts une seule fois par session, d'après l'état du dépôt au démarrage.\n\nUn point de réseau mérite attention. Si l'environnement est en mode `limited`, la création de session échoue avec une erreur 400 quand l'agent déclare un serveur MCP dont l'hôte ne figure pas dans `allowed_hosts`. Mettre `allow_mcp_servers` à `true` dans la configuration réseau de l'environnement désactive cette vérification.\n\n## En pratique\n\nLe premier bloc crée l'agent. Il reprend l'exemple de la documentation, avec les commentaires reformulés. Le client `client` est le client du SDK Python Anthropic, supposé déjà instancié comme dans la documentation.\n\n```python\nagent = client.beta.agents.create(\n    name=\"Code Reviewer\",\n    model=\"claude-opus-5-5\",\n    system=\"You are a code review assistant with access to GitHub.\",\n    mcp_servers=[\n        {\n            \"type\": \"url\",\n            \"name\": \"github\",  # nom réutilisé par mcp_server_name\n            \"url\": \"https://api.githubcopilot.com/mcp/\",\n        },\n    ],\n    tools=[\n        {\"type\": \"agent_toolset_20260401\"},\n        {\n            \"type\": \"mcp_toolset\",\n            \"mcp_server_name\": \"github\",\n        },\n    ],\n)\n```\n\nLe second bloc crée la session et y monte le dépôt. Ici, `environment` désigne un environnement déjà créé.\n\n```python\nsession = client.beta.sessions.create(\n    agent=agent.id,\n    environment_id=environment.id,\n    resources=[\n        {\n            \"type\": \"github_repository\",\n            \"url\": \"https://github.com/org/repo\",\n            \"mount_path\": \"/workspace/repo\",\n            \"authorization_token\": \"ghp_your_github_token\",\n        },\n    ],\n)\n```\n\nLe troisième bloc envoie la tâche à l'agent sous forme d'événement `user.message`. C'est le message d'exemple de la documentation : corriger une erreur de type, valider sur une nouvelle branche, pousser.\n\n```python\nclient.beta.sessions.events.send(\n    session.id,\n    events=[\n        {\n            \"type\": \"user.message\",\n            \"content\": [\n                {\n                    \"type\": \"text\",\n                    \"text\": \"Fix the type error in src/utils.ts, commit it to a new branch, and push it.\",\n                },\n            ],\n        },\n    ],\n)\n```\n\nPour plusieurs dépôts, il suffit d'ajouter des entrées à `resources`, chacune avec son `mount_path` : la documentation donne l'exemple d'un `frontend` monté sous `/workspace/frontend` et d'un `backend` sous `/workspace/backend`.\n\n**Cas d'usage.** Une équipe maintient une application dont le client web et l'API vivent dans deux dépôts. Elle monte les deux dans la même session, sous `/workspace/frontend` et `/workspace/backend`, et demande à l'agent de répercuter un changement de type des deux côtés. L'agent lit et modifie les deux arborescences, puis passe par le serveur GitHub MCP pour pousser ses branches, sans que l'équipe n'ait à préparer un poste de travail.\n\n**Renouveler un jeton en cours de session.** Chaque ressource reçoit un `id` à la création de session, récupérable aussi via `GET /v1/sessions/{session_id}/resources`. Un jeton à courte durée de vie peut être remplacé sans recréer la session :\n\n```python\nlisted = client.beta.sessions.resources.list(session.id)\nrepo_resource_id = listed.data[0].id\n\nclient.beta.sessions.resources.update(\n    repo_resource_id,\n    session_id=session.id,\n    authorization_token=\"ghp_your_new_github_token\",\n)\n```\n\n## Ce que ça change, et où ça s'arrête\n\nL'apport tient à la séparation des rôles : le dépôt arrive dans le bac à sable avec un jeton de clonage, le serveur MCP fournit les outils d'écriture, et l'agent enchaîne lecture, modification et publication dans une même session. Le cache des dépôts réduit le temps de démarrage des sessions répétées.\n\nLes limites documentées sont nettes :\n\n- les dépôts sont attachés pour toute la durée de la session ; pour en changer, il faut créer une nouvelle session ;\n- seules les URL HTTPS sans `.git` sont acceptées ;\n- la documentation recommande des jetons à granularité fine (*fine-grained personal access tokens*) avec les permissions minimales, et déconseille les jetons à large accès. Le scope `repo` couvre le clonage de dépôts privés et la création de pull requests ; la lecture et la création de tickets demandent `repo` en privé ou `public_repo` en public ;\n- la fonctionnalité est en bêta, ce qui expose à des changements de noms de champs ou de comportements.\n\nLa documentation ne précise pas, sur cette page, où se place l'identifiant utilisé par le serveur GitHub MCP lui-même, puisque la définition de l'agent n'en contient aucun. Elle ne chiffre pas non plus le coût propre au montage d'un dépôt, ni la taille maximale de dépôt acceptée. Ces deux points sont à vérifier avant un usage sur de gros dépôts.",
  "statut": "publie"
}