{
  "slug": "anthropic-prise-en-charge-pdf",
  "titre": "Anthropic : lire et interroger des PDF avec Claude",
  "date": "2026-08-24T08:00:00+02:00",
  "type": "explication",
  "labo": "anthropic",
  "fonctionnalite": "prise en charge des pdf",
  "chapeau": "Claude peut recevoir un PDF entier dans une requête et répondre sur son texte comme sur ses graphiques. La fonctionnalité s'appuie sur la vision du modèle, avec ses coûts et ses limites propres.",
  "corps": "## Ce que c'est\n\nClaude peut recevoir un fichier PDF directement dans une requête et répondre à des questions portant aussi bien sur le texte que sur les éléments visuels du document : graphiques, tableaux, mises en page. La documentation cite comme cas d'usage l'analyse de rapports financiers, l'extraction d'informations dans des documents juridiques, l'aide à la traduction de documents et la conversion d'un document en formats structurés.\n\nLa prise en charge des PDF n'est pas un système séparé : elle repose sur les capacités de vision de Claude. Chaque page du document est convertie en image, et le texte extrait de la page lui est associé. Claude reçoit donc, pour chaque page, à la fois une image et le texte correspondant, ce qui lui permet de commenter aussi bien un graphique que le contenu textuel qui l'entoure.\n\n## Comment ça marche\n\nUn PDF s'envoie dans un bloc de contenu de type `document`, à côté d'un bloc `text` qui porte la question. Trois façons de fournir le fichier sont documentées : une URL publique, des données encodées en base64, ou un `file_id` obtenu via l'API Files. Sur Amazon Bedrock et Google Cloud, seule la source base64 est disponible actuellement ; sur Microsoft Foundry, l'API Files n'est pas prise en charge pour les déploiements hébergés sur Azure.\n\nAvec une URL publique :\n\n```bash\ncurl https://api.anthropic.com/v1/messages \\\n  -H \"content-type: application/json\" \\\n  -H \"x-api-key: $ANTHROPIC_API_KEY\" \\\n  -H \"anthropic-version: 2023-06-01\" \\\n  -d '{\n    \"model\": \"claude-opus-5\",\n    \"max_tokens\": 1024,\n    \"messages\": [{\n        \"role\": \"user\",\n        \"content\": [{\n            \"type\": \"document\",\n            \"source\": {\n                \"type\": \"url\",\n                \"url\": \"https://exemple.org/rapport.pdf\"\n            }\n        },\n        {\n            \"type\": \"text\",\n            \"text\": \"Quels sont les points clés de ce document ?\"\n        }]\n    }]\n  }'\n```\n\nAvec des données en base64, le bloc `source` prend la forme `{\"type\": \"base64\", \"media_type\": \"application/pdf\", \"data\": \"...\"}`. Avec l'API Files, on envoie d'abord le fichier vers `/v1/files`, puis on référence l'identifiant renvoyé : `{\"type\": \"file\", \"file_id\": \"...\"}`. Cette dernière option évite de réencoder le fichier à chaque appel, ce qui est utile pour un document interrogé plusieurs fois.\n\nLa requête doit respecter des limites précises : 32 Mo au maximum pour l'ensemble de la charge utile (variable selon la plateforme), et 600 pages par requête — 100 pages seulement si la fenêtre de contexte du modèle appelé est inférieure à 1 million de tokens. Le format doit être un PDF standard, sans mot de passe ni chiffrement.\n\nSur Amazon Bedrock, la documentation signale une particularité de l'API Converse : sans activer les citations, l'API se rabat sur une extraction de texte simple qui ignore images, graphiques et mises en page, et consomme environ 1 000 tokens pour un PDF de trois pages contre environ 7 000 tokens en mode visuel complet. L'API InvokeModel, elle, donne accès au mode visuel sans imposer les citations.\n\n## En pratique\n\nUn cabinet d'analyse financière reçoit chaque trimestre des dizaines de rapports annuels au format PDF, avec des tableaux de résultats et des graphiques que les outils d'extraction de texte classiques ignorent. En envoyant chaque rapport comme bloc `document` accompagné d'une question ciblée, l'équipe peut demander directement à Claude de lire un graphique de répartition du chiffre d'affaires ou de comparer deux tableaux financiers, sans étape intermédiaire de conversion.\n\nPour un traitement à grande échelle, la documentation recommande de combiner la prise en charge des PDF avec la mise en cache de prompt, en ajoutant `cache_control` au bloc `document` :\n\n```json\n{\n  \"type\": \"document\",\n  \"source\": {\n    \"type\": \"base64\",\n    \"media_type\": \"application/pdf\",\n    \"data\": \"...\"\n  },\n  \"cache_control\": { \"type\": \"ephemeral\" }\n}\n```\n\nCela évite de repayer le traitement complet du document à chaque question posée sur le même fichier. Pour du volume, l'API Message Batches accepte elle aussi des blocs `document` dans chacune de ses requêtes, ce qui permet de soumettre plusieurs PDF et plusieurs questions en un seul envoi asynchrone.\n\nCôté bonnes pratiques, la documentation conseille de placer le PDF avant le texte de la question dans la requête, d'utiliser des polices standards, de vérifier que le texte est net et lisible, de remettre les pages à l'endroit si nécessaire, et de découper les documents volumineux en sections lorsque la densité de contenu risque de saturer la fenêtre de contexte avant même d'atteindre la limite de pages.\n\n## Ce que ça change, et où ça s'arrête\n\nLe coût d'un PDF combine deux composantes : le texte extrait, facturé entre 1 500 et 3 000 tokens par page selon la densité du contenu, au tarif standard sans supplément particulier ; et l'image de chaque page, facturée selon le même calcul que pour une image classique envoyée à Claude. Le point de terminaison de comptage de tokens permet d'estimer ce total avant l'envoi.\n\nLa limite la plus concrète tient à la nature même du mécanisme : parce que chaque page est traitée comme une image, un PDF dense — beaucoup de texte en petite police, tableaux complexes, illustrations chargées — peut saturer la fenêtre de contexte bien avant d'atteindre la limite de 600 pages, y compris en passant par l'API Files. La documentation recommande dans ce cas de fractionner le document ou de réduire la résolution des images intégrées.\n\nLa prise en charge des PDF hérite aussi des limites générales de la vision de Claude, puisqu'elle s'appuie sur le même mécanisme. Les fichiers au format .txt, .csv ou .md peuvent être utilisés directement dans un bloc `document` en les téléversant avec le type MIME `text/plain`, mais les formats binaires comme .xlsx ou .docx ne sont pas pris en charge tels quels : ils doivent d'abord être convertis en texte ou en PDF. Enfin, sur Amazon Bedrock, le comportement diffère selon l'API utilisée (Converse ou InvokeModel), ce qui mérite d'être vérifié avant un déploiement sur cette plateforme précise.",
  "tags": ["pdf", "vision", "documents", "api"],
  "sources": [
    { "titre": "Claude Docs — PDF support", "url": "https://platform.claude.com/docs/en/build-with-claude/pdf-support", "consultee": "2026-08-24" },
    { "titre": "Claude Docs — Vision", "url": "https://platform.claude.com/docs/en/build-with-claude/vision", "consultee": "2026-08-24" },
    { "titre": "Claude Docs — Prompt caching", "url": "https://platform.claude.com/docs/en/build-with-claude/prompt-caching", "consultee": "2026-08-24" }
  ],
  "statut": "publie"
}
